<?xml version="1.0" encoding="UTF-8"?>
<!DOCTYPE I5XJTC_kurzusfelvetel SYSTEM "I5XJTC_kurzusfelvetel.dtd">

<I5XJTC_kurzusfelvetel tanev="2023/2024">
	<kurzusfelvetel>
		<kurzus id="GEIAL332-B" jovahagyas="igen">
			<kurzusnev>Adatkezelés XML környezetben</kurzusnev>
			<kredit>5</kredit>
			<hely>XXXII.</hely>
			<idopont>Kedd 12:00-13:30</idopont>
			<oktato>Dr. Bednarik László</oktato>
		</kurzus>
	</kurzusfelvetel>
</I5XJTC_kurzusfelvetel>